track,condition_class,condition,time_h,endpoint,value,unit,mean_or_median,error,n,organism_bucket,organism,model,assay,pmid,doi,figure_table,notes
Track A,Control/baseline,see notes,NOT_REPORTED,absolute protein abundance,NOT_REPORTED,fmol/ug membrane protein (NOT_REPORTED - paywalled body),NOT_REPORTED,NOT_REPORTED,NOT_REPORTED,other,human/chimeric-mouse,uPA/SCID humanized-liver mouse vs human liver,targeted LC-MS/MS,24711249,10.1124/dmd.114.057646,Tables (not in accessible full text),[Track A]; transporter=BSEP; gene=ABCB11; quantity_type=total abundance (absolute); substrate_condition=none/see notes; temperature=NOT_REPORTED; url=https://doi.org/10.1124/dmd.114.057646; usable_for_human_wholecell=proxy/mixed - value NOT_REPORTED; Validation of humanized-liver mouse; transporter absolute quantification. Values NOT accessible (Elsevier paywall body).
Track B,Control/baseline,constitutive cycling (basal),NOT_REPORTED,single BSEP-YFP molecule canalicular membrane residence,transient (residing only transiently before exchanging with intracellular pool),qualitative,NOT_REPORTED,NOT_REPORTED,NOT_REPORTED,other,rat/human hybrid,WIF-B9 polarized hepatic cells (rat hepatoma x human fibroblast),"selective photobleaching / FRAP, live confocal imaging of BSEP-YFP",15121884,10.1091/mbc.e03-10-0737,Results/Fig 4-6,"[Track B]; substrate_condition=basal; temperature=37C; direct_url=https://pubmed.ncbi.nlm.nih.gov/15121884/; usable_for_human_wholecell=non-human/indirect proxy (WIF-B9 cell line); Numeric rate NOT_REPORTED. Exchange blocked by microtubule+actin inhibitors; UNAFFECTED by brefeldin A, dibutyryl-cAMP, taurocholate, PI3K inhibitors. rab11-positive recycling endosome pathway; carriers fuse only with canalicular (not basolateral) membrane"
Track B,Control/baseline,4PBA treatment vs control,NOT_REPORTED,cell-surface-resident BSEP half-life (prolonged by 4PBA),prolonged (numeric NOT_REPORTED in abstract; measured by biotinylation chase),h,NOT_REPORTED,NOT_REPORTED,NOT_REPORTED,other,dog (canine kidney) / human BSEP,MDCK II cells expressing human BSEP,cell-surface biotinylation degradation chase,17538928,10.1002/hep.21630,Results (half-life fig),[Track B]; substrate_condition=4-phenylbutyrate (clinically achievable conc.); temperature=37C; direct_url=https://pubmed.ncbi.nlm.nih.gov/17538928/; usable_for_human_wholecell=non-human cell line expressing HUMAN BSEP; 4PBA prolonged surface-resident BSEP half-life => increased functional surface expression of WT/E297G/D482G BSEP; also raised canalicular BSEP + [3H]TC biliary excretion in rats in vivo. Exact half-life values in figures (full text paywalled)
Track B,Control/baseline,chimeric ubiquitin-BSEP vs BSEP,NOT_REPORTED,degradation rate of surface-resident BSEP (ubiquitin fusion faster),faster with ubiquitin fusion (relative),qualitative,NOT_REPORTED,NOT_REPORTED,NOT_REPORTED,other,dog/human BSEP,MDCK II cells expressing BSEP,cell-surface biotinylation degradation chase,18829893,10.1124/mol.108.049288,Results,"[Track B]; substrate_condition=short-chain ubiquitination (2-3 ubiquitins); temperature=37C; direct_url=https://pubmed.ncbi.nlm.nih.gov/18829893/; usable_for_human_wholecell=non-human cell line expressing HUMAN BSEP; Mature BSEP shifts 170->190 kDa on ubiquitination (~8 kDa). Ubiquitination reduced by 4PBA, enhanced by PFIC2 mutants E297G/D482G. Ubiquitin-BSEP fusion degraded faster than BSEP. Exact k NOT_REPORTED in abstract"
Track B,Control/baseline,octanoic acid vs control,NOT_REPORTED,cell-surface-resident WT BSEP half-life (prolonged),prolonged (numeric NOT_REPORTED; paywalled body),h,NOT_REPORTED,NOT_REPORTED,NOT_REPORTED,other,dog/human BSEP,MDCK II cells expressing BSEP,cell-surface biotinylation degradation chase,20398791,10.1016/j.bbalip.2010.04.002,Results,[Track B]; substrate_condition=octanoic acid (medium-chain FA); temperature=37C; direct_url=https://pubmed.ncbi.nlm.nih.gov/20398791/; usable_for_human_wholecell=non-human cell line expressing HUMAN BSEP; Prolonged half-life of surface WT BSEP responsible for octanoic-acid-stimulated transport; butyrate acted by different mechanism
Track B,Control/baseline,HAX-1 depletion vs control (surface abundance),NOT_REPORTED,BSEP steady-state apical membrane level increase (HAX-1 RNAi),71,% increase,NOT_REPORTED,NOT_REPORTED,NOT_REPORTED,other,dog/rat BSEP,MDCK cells expressing BSEP,"apical surface quantification, pulse-chase",15159385,10.1074/jbc.M404337200,Abstract/Results,"[Track B]; substrate_condition=HAX-1 RNAi; temperature=37C; direct_url=https://pubmed.ncbi.nlm.nih.gov/15159385/; usable_for_human_wholecell=non-human cell line proxy; HAX-1 RNAi raised apical BSEP 71%. HAX-1 depletion did NOT change BSEP translation, post-translational modification, PM delivery, or half-life"
Track B,Control/baseline,HAX-1 depletion (metabolic labeling retention),4,apical BSEP metabolically-labeled peak time & retention,"peak at 4 h, enhanced retention at 6 and 9 h",h,NOT_REPORTED,NOT_REPORTED,NOT_REPORTED,other,dog/rat BSEP,MDCK cells expressing BSEP,pulse-chase metabolic labeling of apical BSEP,15159385,10.1074/jbc.M404337200,Abstract/Results,[Track B]; substrate_condition=HAX-1 RNAi; temperature=37C; direct_url=https://pubmed.ncbi.nlm.nih.gov/15159385/; usable_for_human_wholecell=non-human cell line proxy; HAX-1/cortactin participate in BSEP internalization from apical membrane; dominant-negative cortactin or EPS15 raised steady-state apical BSEP 2-fold
Track B,Control/baseline,UDCA vs control (cell-surface BSEP),NOT_REPORTED,cell-surface-resident BSEP half-life prolongation by UDCA,prolonged (stabilization; numeric NOT_REPORTED in abstract),h,NOT_REPORTED,NOT_REPORTED,NOT_REPORTED,other,dog/human BSEP,MDCK II cells expressing BSEP,cell-surface biotinylation degradation chase,23722250,10.1007/s00535-013-0833-y,Results,[Track B]; substrate_condition=ursodeoxycholic acid; temperature=37C; direct_url=https://pubmed.ncbi.nlm.nih.gov/23722250/; usable_for_human_wholecell=non-human cell line expressing HUMAN BSEP; UDCA stabilizes BSEP in apical membrane (reduced internalization/degradation). Exact half-life values in full text (paywalled)
Track B,Control/baseline,CHMP5 knockdown vs control (temp-shift),NOT_REPORTED,post-Golgi BSEP plasma-membrane targeting (decreased on ESCRT-III perturbation),significantly decreased PM targeting (P=0.0286),qualitative/p-value,NOT_REPORTED,NOT_REPORTED,98-131 cells counted,other,human,HepG2 / Huh7 cells + hydrodynamic-injection mouse,temperature-shift assay (40C ER -> 30C Golgi -> 37C post-Golgi release) + immunostaining + subcellular fractionation,33750401,10.1186/s12929-020-00706-2,Fig 4a; Fig for R487H/N490D,"[Track B]; substrate_condition=si-CHMP5 vs si-CTL; temperature=40/30/37C sequential; direct_url=https://pubmed.ncbi.nlm.nih.gov/33750401/; usable_for_human_wholecell=human cell line + mouse in vivo proxy; ESCRT-III (CHMP5) required for post-Golgi apical BSEP sorting, preceding Rab11A-regulated apical cycling. Cholestatic mutants in CHMP5-interaction region retained at subapical compartments. Kinetic rate NOT_REPORTED (staged temp-shift, not continuous kinetics)"
Track B,MRP2-loss,ubiquitination role in surface BSEP vs MRP2 degradation,NOT_REPORTED,differential degradation mechanism of surface-resident BSEP and MRP2,differential (BSEP internalized+degraded via ubiquitination; MRP2 differs) - qualitative,qualitative,NOT_REPORTED,NOT_REPORTED,NOT_REPORTED,other,dog/human,MDCK II cells expressing human BSEP or MRP2,cell-surface biotinylation degradation chase + ubiquitination,24378332,10.1124/mol.113.091090,Results,[Track B]; substrate_condition=basal / ubiquitination modulation; temperature=37C; direct_url=https://pubmed.ncbi.nlm.nih.gov/24378332/; usable_for_human_wholecell=non-human cell line expressing HUMAN transporters; Differential roles of ubiquitination in degradation of surface BSEP vs MRP2. Exact degradation rate constants NOT_REPORTED in abstract (full text paywalled)
Track D,Control/baseline,TUDCA dose series on HepG2,NOT_REPORTED,LDH release (cytotoxicity),0.1-1 (no cytotoxicity); 10 (increased LDH),mM,NOT_REPORTED,NOT_REPORTED,NOT_REPORTED,other,human,HepG2 hepatoma line,LDH release,26293671,10.18632/oncotarget.4377,Figure (dose-response),[Track D]; measurement_class=marker_only; measure=TUDCA_cytotoxicity_threshold_LDH; substrate_condition=TUDCA; temperature=NOT_REPORTED; url=https://www.ncbi.nlm.nih.gov/pmc/articles/PMC4695041/; usable_for_human_wholecell=indirect (hepatoma line); bounds usable TUDCA concentration; TUDCA non-toxic 0.1-1 mM; cytotoxic at 10 mM (p<0.001). Context for chaperone/UPR dosing; not a proteostasis rate.
Track D,BSEP-loss,bile-acid challenge of PiZ (ATZ) mice; human AATD liver,NOT_REPORTED,GRP78 translocation into protein aggregates (major non-AAT aggregate component),NOT_REPORTED,NOT_REPORTED,NOT_REPORTED,NOT_REPORTED,NOT_REPORTED,other,mouse; human,PiZ transgenic mouse liver + human AATD liver samples,iBAQ absolute-quantification proteomics of aggregate fraction; immunoblot,39665869,10.1111/liv.16207,Figures/proteomics tables,"[Track D]; measurement_class=protein_amount; measure=GRP78_in_aggregates; substrate_condition=bile acids (elevated serum BA in AATD); temperature=NOT_REPORTED; url=https://www.ncbi.nlm.nih.gov/pmc/articles/PMC11636636/; usable_for_human_wholecell=partial (human AATD liver context; disease-specific proteostatic sink); DIRECTION: bile acids increase aggregation and sequester GRP78 into aggregates, depleting free chaperone. Absolute iBAQ values in supplementary = NOT_REPORTED here."
Track E,BSEP-loss,GCDCA 200 uM apoptotic challenge (no preconditioning),4,apoptosis,15.6,fold-change vs control,mean,NOT_REPORTED,3-10,other,human,HepG2.rNtcp (human hepatoma stably expressing rat Ntcp),caspase-3/7 activity (luminescent),26950211,10.1371/journal.pone.0149782,Fig 1; Results text,"[Track E]; marker=caspase-3/7 activity; co_measured_markers=LDH release (necrosis); study_defined_threshold=NOT_REPORTED; substrate_condition=GCDCA 200 uM challenge, 4 h; temperature=37C; url=https://www.ncbi.nlm.nih.gov/pmc/articles/PMC4780766/; usable_for_human_wholecell=indirect (human hepatoma line + rat transporter) - label; 200 uM GCDCA 4 h -> 15.6-fold caspase-3/7 induction. n reported as 3-10 depending on condition; SEM error but per-value SD NOT_REPORTED in text."
Track E,BSEP-loss,GCDCA 200 uM challenge after 25 uM GCDCA preconditioning 24 h,4,apoptosis,58% reduction vs non-preconditioned,% reduction,mean,NOT_REPORTED,3-10,other,human,HepG2.rNtcp,caspase-3/7 activity,26950211,10.1371/journal.pone.0149782,Fig 1,"[Track E]; marker=caspase-3/7 activity; co_measured_markers=LDH release; study_defined_threshold=NOT_REPORTED; substrate_condition=precond 25 uM GCDCA 24 h, then 200 uM GCDCA 4 h; temperature=37C; url=https://www.ncbi.nlm.nih.gov/pmc/articles/PMC4780766/; usable_for_human_wholecell=indirect - label; Preconditioning hormesis effect."
Track E,BSEP-loss,Preconditioning time-course (25 uM GCDCA) then 200 uM challenge,challenge 4 (precond 2/6/12/24/48),apoptosis,significant protection requires >=24 h preconditioning; gradual decrease at intermediate times,qualitative/temporal,NOT_REPORTED,NOT_REPORTED,NOT_REPORTED,other,human,HepG2.rNtcp,caspase-3/7 activity,26950211,10.1371/journal.pone.0149782,Fig 4,"[Track E]; marker=caspase-3/7 activity; co_measured_markers=LDH; study_defined_threshold=NOT_REPORTED; substrate_condition=precond 25 uM GCDCA 2,6,12,24,48 h then 200 uM 4 h; temperature=37C; url=https://www.ncbi.nlm.nih.gov/pmc/articles/PMC4780766/; usable_for_human_wholecell=indirect - label; Preconditioning time-dependence (2-48 h)."
Track E,Control/baseline,Preconditioning concentration-response (24 h) then 200 uM challenge,4,apoptosis,1 uM precond -> 48.5% reduction; 25 uM precond -> 77% reduction,% reduction,mean,NOT_REPORTED,3,other,human,HepG2.rNtcp,caspase-3/7 activity,26950211,10.1371/journal.pone.0149782,Fig 4,[Track E]; marker=caspase-3/7 activity; co_measured_markers=LDH; study_defined_threshold=NOT_REPORTED; substrate_condition=precond 0.25-25 uM GCDCA 24 h then 200 uM 4 h; temperature=37C; url=https://www.ncbi.nlm.nih.gov/pmc/articles/PMC4780766/; usable_for_human_wholecell=indirect - label; Concentration-dependent protection.
Track E,BSEP-loss,GCDCA 200 uM challenge (necrosis check),4,necrosis,no increase in LDH (no necrotic death) at 200 uM 4 h,% of total LDH,mean,SEM (value NR),3,other,human,HepG2.rNtcp,LDH release,26950211,10.1371/journal.pone.0149782,Fig 3,[Track E]; marker=LDH release; co_measured_markers=caspase-3/7 activity; study_defined_threshold=NOT_REPORTED; substrate_condition=200 uM GCDCA 4 h +/- preconditioning; temperature=37C; url=https://www.ncbi.nlm.nih.gov/pmc/articles/PMC4780766/; usable_for_human_wholecell=indirect - label; Death mode is apoptotic not necrotic in this system at this dose/time; digitonin=100% leakage reference.
Track E,Control/baseline,GCDC exposure,NOT_REPORTED,apoptosis,"GCDC induces apoptosis in rat hepatocytes & HUH7-Ntcp; PKC-delta silencing increases apoptosis, CA/WT PKC-delta attenuates",qualitative,NOT_REPORTED,NOT_REPORTED,NOT_REPORTED,other,human;rat,HUH7-Ntcp (human) & primary rat hepatocytes,Hoechst apoptotic morphology + caspase-3 cleavage immunoblot,25359536,10.1152/ajpgi.00165.2014,figure-based (full text body not retrieved; abstract),[Track E]; marker=caspase-3 cleavage + Hoechst apoptotic nuclei; co_measured_markers=JNK phospho; Akt phospho; BIM expression; PKC-delta translocation/phospho; study_defined_threshold=NOT_REPORTED; substrate_condition=GCDC (glycochenodeoxycholate); temperature=NOT_REPORTED; url=https://www.ncbi.nlm.nih.gov/pmc/articles/PMC4269680/; usable_for_human_wholecell=partially (human HUH7-Ntcp line) - label; Full-text body not retrieved (abstract only) -> quantitative time/values NOT_REPORTED. GCDC-induced apoptosis co-measured with JNK/Akt/BIM. BIM knockdown reduces apoptosis.
Track F,Control/baseline,WT vs ICAM-1 knockout HepG2,NOT_REPORTED,bile-canaliculus (BC) area,18.9 vs 51.2,µm^2,mean,±1.1 (WT); ±7.2 (KO) SD,≥70 cells per experiment,other,human,HepG2 polarized hepatic epithelial cells,confocal IF + area segmentation,38597186,10.7554/eLife.89261,NOT_REPORTED,"[Track F]; modality=confocal immunofluorescence, BC area quantification; feature=bile-canaliculi size (apical BC-like structures); figure_number=Fig 1E; what_image_shows=Apical bile-canalicular-like structures (F-actin/apical markers) in polarized HepG2; ICAM-1_KO cells show markedly enlarged BC area (51.2 µm2) vs WT (18.9 µm2); rescue with ICAM-1-GFP reduces size; scale_bar=20 µm; license_status=CC-BY 4.0 (eLife; full text states 'Creative Commons Attribution License / CC BY'. NB: PMC copyright-status API returned is_open_access=False/type=None — journal license overrides); substrate_condition=genetic ICAM-1 KO; temperature=NOT_REPORTED; url=https://doi.org/10.7554/eLife.89261; usable_for_human_wholecell=partial (human hepatoma line HepG2, not primary hepatocytes); BC area WT 18.9±1.1 µm2 → ICAM-1_KO 51.2±7.2 µm2, mean±SD, ≥70 cells/experiment, ***p<0.001. Human hepatoma model."
Track F,Control/baseline,WT vs ICAM-1 KO,NOT_REPORTED,BC dynamics — enlarged BCs in KO; frame-to-frame variation not different WT vs KO,NOT_REPORTED,NOT_REPORTED,NOT_REPORTED,NOT_REPORTED,NOT_REPORTED,other,human,HepG2 polarized hepatic epithelial cells,live time-lapse fluorescence microscopy; cryo soft-X-ray tomography,38597186,10.7554/eLife.89261,NOT_REPORTED,[Track F]; modality=live time-lapse fluorescence + Cryo-SXT; feature=bile-canaliculi dynamics; figure_number=Fig 2A/2B (Videos 1-2); what_image_shows=Time-lapse of bile-canalicular-like structures in HepG2 and cryo-SXT tomograms; ICAM-1_KO cells form enlarged BCs; frame-to-frame dynamic variation similar between WT and KO; scale_bar=2 µm (2A); see legend; license_status=CC-BY 4.0 (eLife; full text states 'Creative Commons Attribution License / CC BY'. NB: PMC copyright-status API returned is_open_access=False/type=None — journal license overrides); substrate_condition=genetic ICAM-1 KO; temperature=NOT_REPORTED; url=https://doi.org/10.7554/eLife.89261; usable_for_human_wholecell=partial (human HepG2); Dynamics qualitative; enlargement quantified in Fig 1.
